{
  "schemaVersion": 0,
  "id": "selection.village.editor",
  "primarySelectionId": "selection.hero",
  "items": [
    {
      "id": "selection.hero",
      "target": {
        "kind": "sceneEntity",
        "sceneId": "scene.village",
        "entityId": "entity.player"
      },
      "bounds": {
        "x": 4.0,
        "y": 4.0,
        "z": 1.0,
        "width": 1.0,
        "height": 1.0
      }
    },
    {
      "id": "selection.tile.grass",
      "target": {
        "kind": "mapTile",
        "mapId": "map.village",
        "layerId": "terrain",
        "position": {
          "column": 2,
          "row": 3
        }
      },
      "bounds": {
        "x": 2.0,
        "y": 3.0,
        "z": 0.0,
        "width": 1.0,
        "height": 1.0
      }
    },
    {
      "id": "selection.bed.asset",
      "target": {
        "kind": "asset",
        "assetId": "asset.bed.simple"
      },
      "bounds": null
    },
    {
      "id": "selection.market.region",
      "target": {
        "kind": "mapRegion",
        "mapId": "map.village",
        "regionId": "region.market"
      },
      "bounds": {
        "x": 6.0,
        "y": 2.0,
        "z": 0.0,
        "width": 3.0,
        "height": 2.0
      }
    }
  ]
}
